AC-9168,[Issue] Remove unnecessary scripts review summary,https://github.com/magento/magento2/issues/37776,"The system now optimizes page load time by removing unnecessary JavaScript scripts from the rating section, instead using inline CSS styles for a more efficient and readable code. Previously, the use of JavaScript scripts for the rating section could potentially slow down page load time.",<https://github.com/magento/magento2/pull/34643>,UI Framework
AC-9240,Deleting Customer Does Not Clean All Browser Session Data on Storefront for Logged in & Deleted Customer,"","Deleting a customer now cleans all browser session data from the storefront for logged-in and deleted customers as expected. The shopper can continue shopping, and their browser treats their session as a guest session. Previously, when the customer account for a logged-in shopper was deleted from the Admin, then the shopper’s browser threw JavaScript errors.",<https://github.com/magento/magento2/commit/7d5e3906>,Customer/ Customers
AC-9922,Google Analytics CSP Error https://region1.analytics.google.com,https://github.com/magento/magento2/issues/37750,"The system now correctly allows connections to 'https://region1.analytics.google.com' when Google Analytics is enabled, preventing Content Security Policy (CSP) errors. Previously, enabling Google Analytics and viewing the website from the EU would result in CSP console errors due to a refusal to connect to 'https://region1.analytics.google.com'.",<https://github.com/magento/magento2/pull/38991>,Analytics / Reporting
ACP2E-2139,Products assigned to shared catalog are not reflect on the front end when partial index is executed,"","Products assigned to shared catalog via REST API are now immediately visible on storefront after partial indexing is complete. Previously, Products were visible only after a full re-indexation.",<https://github.com/magento/magento2/commit/7377de59>,B2B
ACP2E-2974,Translations for customer return attributes not reflected in GraphQL API for respective StoreView,"","Translations for customer return attributes are reflected in GraphQL API for respective StoreView.
Previously customer Return attributes for respective StoreView were not reflected in GraphQL API.",<https://github.com/magento/magento2/commit/ec7e32a9>,GraphQL
ACP2E-3038,Restricted admin users can't always see custom shared catalogs,"","Restricted admin users can now consistently view and manage customers and all shared catalogs to which the products are assigned, provided they have access to the specific store. Previously, a restricted admin user with access to a particular store could not always see all shared catalogs to which the products were assigned or could see customers that could not save, leading to inconsistencies in the system.",<https://github.com/magento/magento2/commit/7377de59>,"Account, Admin UI, B2B"
ACP2E-3063,[Cloud] Cache is not getting invalidated.,"","Previously, when saving a CMS page with an updated design layout, it did not reflect appropriately on the front end. After this fix is applied, the appropriate design layout will be visible at the front end when we change the design layout and save the CMS page.",<https://github.com/magento/magento2/commit/66dea0de>,"Catalog, Content"
ACP2E-3103,New Products RSS feed is not updated with new products due to cache,"",The Rss feed for New Products is now updated when a product is set as new and saved,<https://github.com/magento/magento2/commit/d01ee51e>,Catalog
ACP2E-3122,[CLOUD] Upload image button doesn't work,"","Before the Upload Image button for Banner and Slider from PageBuilder didn't work as expected, and now when pressing it opens the local file manager to select the wanted image to upload.",<https://github.com/magento/magento2-page-builder/commit/476ef8ea>,Content
ACP2E-3131,[Cloud] Anchor/Non-Anchor Categories Reversed in Content Widget,"","Previously, when we selected Display On -> Anchor Categories, it showed all the categories that did not reflect the parent-child relation between the anchor and non-anchor. After this fix is applied, the  Display On -> Anchor Categories only displays Anchor Categories (selectable), and  Display On -> Non Anchor Categories displays Non-Anchor Categories (selectable)",<https://github.com/magento/magento2/commit/7377de59>,"Catalog, Content"
ACP2E-3139,Sales Rule with Discount Qty Step (Buy X) attribute causes other rules to not be applied,"",Cart price rule does not cancel previously applied rules if quantity of the product in the cart is not enough for rule to be applied.,<https://github.com/magento/magento2/commit/d01ee51e>,Promotion
ACP2E-3143,PayPal order refund results in duplicate credit memo,"",Fixed concurrency issue of IPN-created credit memos for PayPal payment service.,<https://github.com/magento/magento2/commit/d01ee51e>,Payments
ACP2E-3146,GTM missing addToCart event in dataLayer for configurable product with custom option,"","Previously, the addToCart event was not being triggered for configurable products. Now, the event is properly added to the GTM dataLayer variable.","",Analytics / Reporting
ACP2E-3152,Categories not working with widgets,"","Previously, if we saved the CMS block for different anchor/non-anchor categories, it did not work for the child categories when it showed on the front end. After this fix has been applied, the block is shown at the front end for different categories.",<https://github.com/magento/magento2/commit/d01ee51e>,"Catalog, Content"
ACP2E-3163,Cart price rule not working for Paypal,"",Correct amount is shown on PayPal side when discount is applied by payment method,<https://github.com/magento/magento2/commit/7377de59>,Payments
ACP2E-3172,Import button missing,"",Resolve the Import button missing issue after data checks with correct and incorrect records in the CSV. Previously the import button doesn't display after data checks with correct and incorrect records in the CSV.,<https://github.com/magento/magento2/commit/1819fe73>,Import / export
ACP2E-3176,[Cloud] quick order large amount of SKU performance,"",Checkout performance has been improved when attributes used in cart price rules conditions are not present for all products and when MAP (Minimum advertised price) feature is enabled.,<https://github.com/magento/magento2/commit/66dea0de>,Cart & Checkout
ACP2E-3183,NewRelic browser monitoring inlineJS  script causes CSP errors,"","NewRelic Browser Monitoring scripts are now injected by the application instead of the APM agent for compliance with CSP (Content Security Policy). Previously, NewRelic Browser Monitoring scripts injected by APM agent were not compliant with CSP and caused the scripts to not be executed.",<https://github.com/magento/magento2/commit/66dea0de>,Analytics / Reporting
ACP2E-3187,Metric in NR might be misleading for background transactions- Follow up of ACP2E-3067,"",Background transactions (cron) will use New Relic app name defined in the config settings,<https://github.com/magento/magento2/commit/ec7e32a9>,"Analytics / Reporting, Cloud"
ACP2E-3189,INSERT queries to the sales_bestsellers_aggregated_daily table become slow on project with large sales order volume,"",Previously the bestsellers aggregated daily report would take a lot of time to generate for large volume of placed orders. Now the report is generated in a timely manner.,<https://github.com/magento/magento2/commit/7377de59>,Analytics / Reporting
ACP2E-3193,Fixed Product Tax (FPT) is not working with configurable products,"",FPT for configurable product variations working properly.,<https://github.com/magento/magento2/commit/ec7e32a9>,Tax
ACP2E-3195,Shipping address empty while placing an order for a gift registry item,"","Previously, for guest user gift-registry items, when returned from the email function, generated an empty blank address, which is incorrect for placing an order. After this fix is applied, the gift registry checks logged-in user/guest users and assigned addresses if they exist.","","Catalog, Shipping"
ACP2E-3198,[cloud] Two-finger zoom and move issue on the real mobile device,"","The system now ensures consistent image zoom functionality on mobile devices, providing a smooth and predictable user experience. Previously, the image zoom feature was inconsistent and would suddenly zoom out after a certain point when viewed on a mobile device.",<https://github.com/magento/magento2/commit/1366ae5e>,Catalog
ACP2E-3208,[Cloud] Users with a specific role cannot login,"",admin user with role that contain only PayPal Section access now can login without errors,<https://github.com/magento/magento2/commit/66dea0de>,Payments
ACP2E-3211,Duplicated items in cart,"","The system now correctly processes multiple parallel requests to add the same product to the cart into a single line item, preventing the creation of separate line items for the same SKU. Previously, making parallel requests to add the same product to the cart on Storefront would result in multiple line items for the same SKU.",<https://github.com/magento/magento2/commit/66dea0de>,Cart & Checkout
ACP2E-3215,[Cloud] Issue with User Authentication and Cross-Site Token Access in Multi-Site Setup,"","GraphQl Customer Info and Cart queries in Multi-Site setup checks if the customer on non-default website exists.
Previously query worked without making sure the customer exists on non-default website in Multi-Site setup.",<https://github.com/magento/magento2/commit/581b7ef1>,GraphQL
ACP2E-3230,Modifying column length via db_schema.xml doesn't work in case of foreign keys,"",modifying column with foreign key via declarative schema now doesn't rise errors with MariaDB,<https://github.com/magento/magento2/commit/581b7ef1>,Framework
ACP2E-3233,Admin can still place order even without payment method,"","Previously, the merchant could place orders from the admin panel without selecting a payment method. Now, the merchant is required a payment method to proceed with placing an order.",<https://github.com/magento/magento2/commit/fd5cf3af>,"Order, Payments"
ACP2E-3236,Async operation fails when the SKU is missing from the payload,"","Async and sync operations previously failed due to product save errors if sku is missing from payload. After the fix, the async and sync product save rest api operations fail with relevant exception message.",<https://github.com/magento/magento2/commit/66dea0de>,APIs
ACP2E-3246,Customer API - Login Failures Number Not Able To Reset To 0 After Successful Login,"",Now failure number is reset to zero in customer entity table after customer successful login through API endpoints.,<https://github.com/magento/magento2/commit/ec7e32a9>,"Account, APIs, GraphQL"
ACP2E-3247,sales_clean_quotes cron deletes quotes from to yet approved purchase orders,"",Quotes used in purchase orders now will not be deleted by sales_clean_quotes cron job,<https://github.com/magento/magento2/commit/581b7ef1>,B2B
ACP2E-3255,[GRAPHQL] model value should be specified when getting customerCart,"","The GraphQL 'customerCart' query can now create an empty cart even when the quote is not available in the database. Previously, this operation failed due to country validation issues while creating the empty cart.",<https://github.com/magento/magento2/commit/fd5cf3af>,GraphQL
ACP2E-3273,ReCaptcha V2 shows incorrectly on checkout for German language,"","Previously the recaptcha from under email address from checkout appear unstyled for languages with long words, like german. After this the recaptcha looks the same as all recaptcha elements from the rest of the areas.",<https://github.com/magento/magento2/commit/7377de59>,Security
ACP2E-3275,[Cloud] - CMS Slider not reflecting the latest changes,"","The issue has been fixed by ensuring the slider list gets refreshed while the save event is triggered on the edit slide screen. Previously, it was triggering and causing the issue.",<https://github.com/magento/magento2-page-builder/commit/ae2cdeb0>,Content
ACP2E-3276,Order reports showing the wrong currency symbol,"",The currency symbol for order amounts in the Order Report was incorrectly taken from currency/options/base. It has now been corrected to use currency/options/default for accurate reporting.,<https://github.com/magento/magento2/commit/fd5cf3af>,Analytics / Reporting
ACP2E-3282,"When we unassign products from the shared catalog, the wishlist products are not being cleared","","Now, no items are visible in the wishlist if a product is not available in the shared catalog. Previously, the wishlist page incorrectly displayed a count of ""1 Item"" even when no items were actually available in the wishlist.",<https://github.com/magento/magento2/commit/5184c067>,Catalog
ACP2E-3286,Related products Select All/Unselect All Issue,"","Previously, the ""Select All""/""Unselect All"" buttons for related products didn't work correctly if a product was manually selected. After the fix, these buttons now function consistently, even after manual selection, ensuring that all products are properly selected or unselected.",<https://github.com/magento/magento2/commit/fd5cf3af>,Catalog
ACP2E-3294,The shipping address state is not auto updating,"","Prior to the fix, the shipping address region (or region id) was not in sync with the address billing information. Now, both shipping address region and region id are properly updated when billing address information is changed.",<https://github.com/magento/magento2/commit/581b7ef1>,Admin UI
ACP2E-3296,Checkout order email confirmation is sent to emails entered in First/Last name,"","The checkout order email confirmation, which was previously sent when an email-like pattern was entered in the First and Last Name fields, is no longer being sent.",<https://github.com/magento/magento2/commit/5184c067>,Cart & Checkout
ACP2E-3300,Captcha on admin login does not require interaction for some users,"",ReCaptcha for admin login is validated as expected,"",Security
ACP2E-3302,[Cloud] Incorrect Calculations in Coupon Usage Report,"","The sales total in the coupon report grid is now accurately calculated by incorporating both the ""Discount Tax Compensation Amount"" and the ""Shipping Discount Tax Compensation Amount."" Previously, these amounts were missing from the calculation, leading to discrepancies between the sales total and the sales order data.",<https://github.com/magento/magento2/commit/d75cff27>,Analytics / Reporting
ACP2E-3311,[Cloud] Cannot create order in admin on one store if only the Default Billing Address was not set up,"","Now relevant error message ""A customer with the same email address already exists in an associated website."" is displayed if a customer doesn't have a Default Billing Address and tries to create an order on another store.",<https://github.com/magento/magento2/commit/d75cff27>,Order
ACP2E-3312,Tier Prices return wrong value in products GraphQL (compared to Storefront),"","After the fix, product's tier prices returned for graphql requests have price per one item.",<https://github.com/magento/magento2/commit/1366ae5e>,"Catalog, GraphQL"
ACP2E-3324,Possibility to overwrite config value even if it's locked,"","Previously to this fix, the design configuration could not be set through bin/magento config:set command and locked values could be changed by manipulation of the form displaying them. After the fix locked values set from cli with --lock-env or --lock-conf cannot be updated anymore.",<https://github.com/magento/magento2/commit/55615e61>,"Framework, UI Framework"
ACP2E-3326,An error occurs in CSM page when CMS blocks are inserted using page builder in certain order,"","Previously on some versions of PHP and OS (Linux), the rendering of blocks that referenced other cms blocks through PageBuilder would have failed with an ""An unknown error occurred. Please try again."". Now the content of the cms blocks is rendered correctly inside a PageBuilder controlled content.",<https://github.com/magento/magento2-page-builder/commit/ae2cdeb0>,Content
ACP2E-3329,"After logging in, the products added to the compare list as a guest user are not visible.","","Products that were added to product compare list before logging in as a customer now are preserved after logging in.
Previously, after logging in, the products added to the compare list as a guest user were not visible.",<https://github.com/magento/magento2/commit/078c387e>,Account
ACP2E-3330,[CLOUD] Restricted admin users can see the return menu and buttons,"","Restricted Admin users now don't have access to RMA related controls (menu and buttons).
Previously restricted admin users could see the return menu and buttons.","",Returns
ACP2E-3331,Performance issue on Cart price rule - Advance Sales Rule module,"",Added missing DB indexes for AdvancedSalesRule filters,"",Promotion
ACP2E-3332,"Issue sales rules with Fixed amount discount and ""Maximum Qty Discount is Applied To""","","Fixed issue with cart rules discount, when fixed amount discount is configured to be applied for a limited qty of products is the cart. Previously, the ""Maximum Qty Discount is Applied To"" value was used to calculate current item's price in the cart, not only for calculation the rule's discount.",<https://github.com/magento/magento2/commit/581b7ef1>,Promotion
ACP2E-3335,Unable to ship the order when MSI pick up store is enabled,"",Improved inventory performance of create shipping in case of many sources with in-store pickup,<https://github.com/magento/inventory/commit/9f3e63d1>,Inventory / MSI
ACP2E-3336,[Cloud] Stock alert email translation to the wrong language,"","When sending Stock/Price Alerts for a website with multiple store views using different languages, the language for the store view where the alert was created will be used on the email.","<https://github.com/magento/magento2/commit/a4cf5e62>, <https://github.com/magento/inventory/commit/9f3e63d1>",Catalog
ACP2E-3339,"Issues with shared ""<project_id>/var/tmp""","","Analytics DataExport temporary files will use the sys tmp directory, which is more suitable for frequent access and changes. To avoid collisions in case multiple instances are running on the same server, the tmp path was updated to use an instance's unique id",<https://github.com/magento/magento2/commit/a4cf5e62>,Analytics / Reporting
ACP2E-3340,FedEx Track API not working with REST credentials,"",Previously FedEx integration didn't require additional API keys for Tracking API. Now new configuration was added to support Tracking API keys.,<https://github.com/magento/magento2/commit/ec7e32a9>,Shipping
ACP2E-3342,[CLOUD] Magento upgrade caused coupons to become case-sensitive,"","Before the fix you were required to type in the coupon code exactly as it was configured taking into consideration uppercase or lowercase. Now, the coupon will be validated in the backend regardless of uppercase or lowercase code configuration.","",Promotion
ACP2E-3343,Critical 500 Error: Magento\Framework\Webapi\Exception Related to Accept HTTP Header,"","After the fix, there is no issue with specifying the ""Accept"" header.",<https://github.com/magento/magento2/commit/1366ae5e>,"APIs, Cart & Checkout"
ACP2E-3345,Type Error occurred when creating object: Magento\CatalogSearch\Model\Indexer\Fulltext\Interceptor Exception,"","After the fix, an instance of Magento\CatalogSearch\Model\Indexer\Fulltext class can be created without specifying $data.",<https://github.com/magento/magento2/commit/1366ae5e>,"Catalog, Search"
ACP2E-3348,no graphQl available for subscribing Reward Points updates for customer,"","Previously to the fix, customer attribute reward_warning_notification could not be updated through GraphQL mutation and Rest API call. Now can be updated the same as customer attribute reward_update_notification.","","APIs, GraphQL"
ACP2E-3349,"Cart rules ""Fixed amount discount for whole cart""  Action applies discounts incorrectly","","Coupon codes will be validated properly regardless of upper case or lowercase, when used in order creation from the admin area. Before, the coupon code was not validated if it did not match the exact letter case of the configured cart rule code.",<https://github.com/magento/magento2/commit/581b7ef1>,Promotion
ACP2E-3350,Disabled Categories are no longer have their names grayed out in the category tree,"","Previously, disabled categories were not grayed out in the category tree. Now, they are displayed with a gray-out effect.",<https://github.com/magento/magento2/commit/d75cff27>,Catalog
ACP2E-3354,[Cloud] FedEx Negotiated Rates not returned on REST,"","Previous to the fix,FedEx account specific rates where not sent on the response, even through according to FedEx documentation they should have been sent. After the fix, the account specific rates are sent on the response by changing the request from our side.",<https://github.com/magento/magento2/commit/55615e61>,Shipping
ACP2E-3355,Cron reindex fails to update product availability on the frontend,"","Previously, Products remained out of stock on the frontend after updating the backorder status through the REST API. Now, after updating the backorder status via the REST API, products are shown as in stock.",<https://github.com/magento/inventory/commit/e6fe0aa7>,Inventory / MSI
ACP2E-3357,Adding images to configurable not working when MSI is enabled.,"",Image upload for configurable product will now work as expected when inventory module is used. Previously the image upload didn't work,<https://github.com/magento/inventory/commit/fdf409aa>,Inventory / MSI
ACP2E-3361,Some of the relations records are saved to DB when order record is saved,"","Before the fix unnecessary UPDATE queries were being triggered that can have an impact performance wise. After the fix, the unnecessary UPDATE queries were eliminated.",<https://github.com/magento/magento2/commit/1366ae5e>,Framework
ACP2E-3362,"search_query table when of huge size, has large impact on load time frontend","","Improved search listing page load time. Prior to the fix, the search listing page was being delayed because of an unoptimized query.",<https://github.com/magento/magento2/commit/55615e61>,Search
ACP2E-3363,Magento\GraphQl\App\GraphQlCustomerMutationsTest.php Integration Test failure,"",'-,<https://github.com/magento/magento2/commit/a4cf5e62>,"GraphQL, Test framework"
ACP2E-3364,Reset button doesn't work on Add/Edit admin user,"","Previously, the Reset button did not function on the Add/Edit Admin User page. Now, in the Admin panel under System -> Permissions -> All Users, the Reset button will work correctly on the Add/Edit Admin User page.",<https://github.com/magento/magento2/commit/5184c067>,Admin UI
ACP2E-3367,Site Header | Special Characters Breaking the Customer Welcome section,"","After the fix, special characters are shown correctly in the customer welcome section.",<https://github.com/magento/magento2/commit/1366ae5e>,UI Framework
ACP2E-3374,"In Backend, default store values for product attributes (instead of expected admin values)","","Now In Backend, admin values are used instead of default store values for product attributes.",<https://github.com/magento/magento2/commit/5184c067>,Promotion
ACP2E-3375,[CLOUD] In admin there are many javascript error in console,"","Previously, In admin panel there are many javascript error in console. Now, In the admin panel, there will be no JavaScript errors in the console, and all the default JavaScript functions will execute successfully without any issues.",<https://github.com/magento/magento2/commit/d75cff27>,Framework
ACP2E-3376,[CLOUD] Unable to update the Base-prices using REST API (The value of 'value_id' in 'catalog_product_entity_decimal' is not incremented correctly.),"","Previously to this fix, when rest api /rest/default/V1/products/base-prices was called, the increment id was increased wrongly leaving a gap between values. After the fix the increment id is increased as expected, incrementaly. Also the value_id field range was increased.",<https://github.com/magento/magento2/commit/d50f6b5d>,APIs
ACP2E-3377,"Cart rules ""Fixed amount discount for whole cart""  action applies discounts incorrectly when adding bundle products","","Fixed amount cart rules were not being applied properly for bundle products. Now, when calculating the total discount amount, bundle child products are taken into consideration, resulting in proper discount calculation.",<https://github.com/magento/magento2/commit/1366ae5e>,Promotion
ACP2E-3380,[GraphQl] Wishlist items are visible via GraphQl but not visible on storefront,"","Wishlist products where not being properly listed when requested via GraphQL. Now, wishlist products are filtered based on provided store context.",<https://github.com/magento/magento2/commit/55615e61>,GraphQL
ACP2E-3382,Exported customer address cannot be imported,"","Customer address import will proceed as expected. Previously, a customer address import file would not pass validation if Share Customer Accounts = Global, and there are two websites where the default website has a restricted country list, and the address that is being imported is for another website where allowed countries are different",<https://github.com/magento/magento2/commit/ec7e32a9>,Import / export
ACP2E-3385,[CLOUD] B2B: category issue via GraphQL,"","After the fix, the categories graphql query returns categories with allow permission even if the root category doesn't have allow permission.","","Catalog, GraphQL"
ACP2E-3387,[Cloud] Magento: queue message has been deleted,"","Queue messages are now properly being cleared out. Prior to the fix, given that SQL queue system was being used, new messages could have been deleted if the cleaning queue message was running at the same time.",<https://github.com/magento/magento2/commit/d50f6b5d>,Framework
ACP2E-3388,[Cloud] Dynamic blocks will not function properly,"",Logged-in customer segments are now cleared after logout preventing the guest session from inheriting previously logged-in segments,"",Content
