Issue key,Custom field (Release Note),Summary,Custom field (Git Pull Request),Custom field (External Issue URL),Components
AC-10042,"The system now correctly handles the parent and child concept transactions where the parent transaction ID is the same as the transaction ID, preventing an infinite loop when querying the /V1/transactions REST API endpoint. Previously, this scenario would result in a fatal error due to maximum execution time being exceeded.",/V1/transactions REST API returns error when parent_txn_id = txn_id,<https://github.com/magento/magento2/commit/1bafc571>,"",APIs
AC-10535,"The system now correctly retains special characters in the names of associated products when editing a configurable product, preventing them from being converted into HTML entities. Previously, special characters in associated product names were converted into HTML entities when the configurable product was edited.",Special characters in configurable associate product name are  being Converted to HTML Entities.,<https://github.com/magento/magento2/pull/38447>,https://github.com/magento/magento2/issues/38146,Product
AC-10539,"The system now correctly displays the price of out-of-stock simple products in the ""Recently Viewed Product"" widget, ensuring consistency across all widgets and product list pages. Previously, the price of out-of-stock simple products was not displayed in the ""Recently Viewed Product"" widget due to a condition in the price loading templates.",[Issue]  issue with the price display in the Recently Viewed widget,<https://github.com/magento/magento2/pull/38159>,https://github.com/magento/magento2/issues/38167,Content
AC-10596,"The system now corrects a typo and grammar error in the acl.xsd file, enhancing the clarity and accuracy of the documentation. Previously, the acl.xsd file contained a typo and incorrect grammar which could potentially cause confusion.",[Issue] Correct typo and grammar in acl.xsd file,<https://github.com/magento/magento2/pull/38046>,https://github.com/magento/magento2/issues/38061,Content
AC-10654,"The system now adheres to the constraints set within the management GUI when processing password change requests via the API, preventing potential abuse of the password reset function. Previously, the API could process password change requests outside of the rules defined in the management GUI, potentially allowing for a constant stream of reset emails if valid emails were known.",V1/customers/password endpoint question/issue,<https://github.com/magento/magento2/commit/0c53bbf7>,https://github.com/magento/magento2/issues/38238,Framework
AC-10658,"The system now correctly closes the start tag in the visual.phtml file, ensuring proper HTML syntax. Previously, the start tag was not closed properly, causing an HTML syntax error.",[Issue] Fix HTML syntax error in visual.phtml,<https://github.com/magento/magento2/pull/37457>,https://github.com/magento/magento2/issues/38247,Other Developer Tools
AC-10660,"The system now properly handles exceptions when adding a product to the cart from the compare product page, displaying a message manager message in the controller. Previously, an exception would result in a JSON encoded page being returned instead of being properly caught and handled.",Exception is not getting handled properly while adding a product to cart in the compare product page,"<https://github.com/magento/magento2/pull/38257>, <https://github.com/magento/magento2/commit/0c53bbf7>",https://github.com/magento/magento2/issues/38200,Cart & Checkout
AC-10698,"The system now correctly sends transaction prices and totals to Google Tag when GTag is enabled, ensuring accurate tracking of ecommerce data. Previously, the currency was incorrectly being sent as part of the ""all"" orders, rather than being associated with the individual order.",GTag not send transaction prices and totals.,"<https://github.com/magento/magento2/pull/37504>, <https://github.com/magento/magento2/pull/37349>",https://github.com/magento/magento2/issues/37348,Cart & Checkout
AC-10721,Upgrade the league/flysystem Composer dependencies upgrading to latest version,"",Upgrade the 2.x league/flysystem Composer dependencies to latest version 3.x,<https://github.com/magento/magento2/commit/91cb4d46>,Framework
AC-10750,"The system now correctly updates the inventory of configurable products when the database uses prefixes, preventing any error messages and ensuring the correct quantity is saved. Previously, an error would occur when trying to save the inventory quantity for simple products within a configurable product if the database was using prefixes.",Inventory update of Configurable Product fails when database uses prefixes,"",https://github.com/magento/magento2/issues/38045,Inventory / MSI
AC-10757,"The system now correctly uses the term ""carrier"" instead of the misspelled ""currier"" in the JavaScript handler functions used in the order tracking template, ensuring proper function naming and code clarity. Previously, the misspelled term ""currier"" was used, leading to potential confusion and inconsistency in the codebase.","[Issue] Fixed typo in tracking.phtml - renamed JS-functions ""currier"" to ""carrier""",<https://github.com/magento/magento2/pull/33414>,https://github.com/magento/magento2/issues/34523,Shipping
AC-10782,"The system now validates the input in the First Name and Last Name fields in the customer address form, preventing the use of random code. Previously, the system allowed the use of random code in these fields without throwing an error.",Customer address form allows random code in the name fields,<https://github.com/magento/magento2/pull/38345>,https://github.com/magento/magento2/issues/38331,Account
AC-10828,"The system now displays the number of backordered items in the quantity column on the backend order overview screen. This ensures that users can accurately track the status of all items in an order. Previously, the quantity column only showed the number of items that were ordered, invoiced, and shipped, but did not display the number of backordered items.",Backend order overview screen: Backordered quantity not visible on order item level,<https://github.com/magento/magento2/pull/38320>,https://github.com/magento/magento2/issues/38252,Order
AC-10838,"The system now successfully completes the re-index command without encountering any errors, regardless of the libxml version compiled with PHP. Previously, running the re-index command resulted in a ""Catalog Search index process error during indexation process"" error when PHP was compiled with certain versions of libxml.",Catalog search index process error indexation process,"<https://github.com/magento/magento2/pull/38553>, <https://github.com/magento/magento2/commit/0574ac23>",https://github.com/magento/magento2/issues/38254,Framework
AC-10845,"The system now correctly displays banner images uploaded in newly created folders in the Pagebuilder gallery, eliminating previous console errors. Prior to this fix, banner images were not visible in the gallery if they were uploaded in a new folder, causing a console error.",Pagebuilder banner image not visible in gallery,<https://github.com/magento/magento2/commit/c8f87c25>,"",Content
AC-10910,"The system now automatically cleans up the cron_schedule database table, removing entries for jobs that no longer exist in the system. This ensures optimal performance by maintaining a minimal number of rows in the table. Previously, entries for jobs from inactive or removed modules were not cleaned up, leading to unnecessary data accumulation in the cron_schedule table.",Cleanup of cron_schedule database table doesn't cleanup non-existing jobs,<https://github.com/magento/magento2/pull/38693>,https://github.com/magento/magento2/issues/38217,Catalog
AC-10941,"The system now supports the use of created_at, status, and grand_total filters in customer Orders queries, and has resolved an issue where multiple filters were not being applied correctly. Previously, the system did not support these filters and would fail to apply all filters when more than one was used in a query.","Added created_at, status and grand_total filters to customer Orders query and fixed multiple filters failure",<https://github.com/magento/magento2/pull/36949>,https://github.com/magento/magento2/issues/38392,Framework
AC-10947,"The system now correctly creates a cache key in the ProductRepository's function GetById, regardless of whether the store ID is passed as a string or an integer. This ensures that the product is retrieved from memory on subsequent calls, improving performance. Previously, the system would retrieve the product from the database each time the function was called, even with the same parameters, due to incorrect cache key creation.",ProductRepository function GetById does not create the correct cache key,<https://github.com/magento/magento2/pull/38433>,https://github.com/magento/magento2/issues/38384,Product
AC-10953,"The system now correctly removes the tier price of a product when it is converted from a simple product to a configurable product, ensuring accurate price display on the frontend. Previously, the tier price of a configurable product was not deleted when a product was converted from a simple product to a configurable product, leading to a mismatch in the displayed price.",Tier Price is not being deleted from Configurable Product,<https://github.com/magento/magento2/pull/38427>,https://github.com/magento/magento2/issues/38390,Catalog
AC-10971,"PHP 8.2/8.3, only one dependency fails the php linter at the moment: league/flysystem",https://github.com/magento/magento2/issues/38415,"The system now supports PHP 8.2/8.3 by updating the league/flysystem package to version 3.0.20, ensuring no PHP linting errors occur. Previously, running PHP files through the PHP linter with PHP 8.3 resulted in linting errors in the league/flysystem package.",<https://github.com/magento/magento2/commit/672a2e61>,Framework
AC-10990,"The system now correctly saves customer addresses even when the region field is not displayed, preventing a crash during the save process. Previously, attempting to add or edit an address without a displayed region field would result in an exception error.",my account add address crash on save,<https://github.com/magento/magento2/pull/38407>,https://github.com/magento/magento2/issues/38406,Account
AC-10991,"The system now optimizes queries from related, upsell, and cross-sell blocks, improving the performance and preventing the site from going down due to excessive queries. Previously, the system could become overloaded with queries from these blocks, causing significant slowdowns and potentially bringing the site down.",Randomly getting flooded with queries from related / upsell / crosssell blocks and price indexing ,<https://github.com/magento/magento2/pull/38050>,https://github.com/magento/magento2/issues/36667,Framework
AC-10994,"The system now correctly uses the store ID associated with an order when rendering the order address, ensuring that addresses are formatted correctly according to their respective store ID. Previously, the system was incorrectly using the current store ID, which could lead to incorrect address formatting in cases where multiple order emails from different stores needed to be sent.",[Issue] Wrong store ID used in Order Address Renderer,<https://github.com/magento/magento2/pull/37932>,https://github.com/magento/magento2/issues/38412,Order
AC-11388,Verify Deleting Folder Deletes S3 and Local File Storage Directories,"","","",Framework
AC-11423,Commerce no longer logs the following exception in the exception.log whenever a shopper or merchant visits either the storefront or Admin: `main.CRITICAL: Exception: Warning: Trying to access array offset on value of type null in /vendor/magento/framework/View/Element/Html/Calendar.php on line 114 in /vendor/magento/framework/App/ErrorHandler.php:62`. [GitHub-38214](https://github.com/magento/magento2/issues/38214),Exception: Warning: Trying to access array offset in... -> Calendar.php since upgrade to ICU 74.1 (PHP Intl),<https://github.com/magento/magento2/pull/38364>,https://github.com/magento/magento2/issues/38214,Framework
AC-11474,"The system now provides more accurate status messages for the maintenance mode command, changing the status from ""active"" to ""enabled"" and from ""not active"" to ""disabled"". Previously, the status message for the maintenance mode command was displayed as ""active"" or ""not active"", which could lead to confusion.","[Issue] Changed ""active"" to ""enabled"" in bin/magento maintenance:status command",<https://github.com/magento/magento2/pull/38410>,https://github.com/magento/magento2/issues/38486,Other Developer Tools
AC-11476,"The system now correctly identifies the 'method' attribute in form submissions, even when an element named 'method' is present in the form. This ensures accurate processing of customer data. Previously, if a form element was named 'method', it would interfere with the identification of the 'method' attribute in form submissions, leading to potential issues with customer data handling.",[Issue] Fix issues with Customer Data when form contains element with name `method`,<https://github.com/magento/magento2/pull/38449>,https://github.com/magento/magento2/issues/38484,Framework
AC-11489,"The PHPDocs for the \Magento\Framework\Data\Collection::getItemById method have been updated to include null as a possible return type, addressing issues with static analysis tools. Previously, the method's PHPDocs did not specify null as a possible return type, leading to warnings or errors in static analysis when the method was used in conditional statements.",[Issue] Fix PHPDocs for \Magento\Framework\Data\Collection::getItemById,<https://github.com/magento/magento2/pull/38439>,https://github.com/magento/magento2/issues/38485,Framework
AC-11491,[Skip] Need to be Un-skip again Integration test,"",Un-skip all integration test  which are skipped in this PR - https://github.com/magento-commerce/magento2ce/pull/8811/,<https://github.com/magento/magento2/commit/493e01f5>,Test framework
AC-11588,"The system now correctly validates data and hides the ""Import"" button during the product import process with ""Replace"" behavior, preventing any unintended data replacement. Previously, the system incorrectly validated the data and displayed the ""Import"" button, leading to potential data inconsistencies.",Data validation is success and Import button is present during Import products with Replace behavior,<https://github.com/magento/magento2/commit/0574ac23>,"",Admin UI
AC-11593,"The system now supports the latest Google Maps API version 3.56, allowing users to successfully add a Map content block from the PageBuilder menu to the stage without encountering any errors. Previously, users were unable to add a Map content block due to compatibility issues with the Google Maps API version, resulting in a ""something went wrong"" error message.",Google google API key is not working while adding Map with attributes,<https://github.com/magento/magento2/commit/0574ac23>,"",Inventory / MSI
AC-11641,"The system now correctly omits the shipping address and shipping method from the failed payment email template for virtual products, ensuring only relevant information is included in the email. Previously, the failed payment email for virtual products incorrectly included the shipping address and shipping method.",[Issue] [Checkout] Depend directives updated in failed payment email template,<https://github.com/magento/magento2/pull/32511>,https://github.com/magento/magento2/issues/32781,Cart & Checkout
AC-11651,"The system now allows the modification of previously read-only properties in the LoggerProxy's __wakeup method, ensuring smooth operation without forcing users to employ a workaround. Previously, an attempt to reassign the value of a read-only property in the LoggerProxy's __wakeup method would cause issues.",Magento trying to modify read-only property in __wakeup method of LoggerProxy,<https://github.com/magento/magento2/commit/c8f87c25>,https://github.com/magento/magento2/issues/38526,Framework
AC-11654,"The system now correctly recognizes JSON column types in the database schema during integration tests, preventing test failures due to a mismatch between the database schema and the declarative schema. Previously, the system incorrectly identified JSON column types as LONGTEXT in MariaDB, causing integration tests to fail.",Integration test failing testDbSchemaUpToDate due to JSON column type,<https://github.com/magento/magento2/commit/ef81f5a2>,"",Test framework
AC-11673,Investigate php-amqplib/php-amqplib latest versions,"",Updated the latest version php-amqplib/php-amqplib :^3.x,<https://github.com/magento/magento2/commit/de4dfb8e>,Framework
AC-11681,Updated tinymce latest version in composer.json,[Issue] AC-2039 AC-1667 upgrade TinyMCE references,"<https://github.com/magento/magento2/pull/36543>, <https://github.com/magento/magento2/commit/b34c0a75>",https://github.com/magento/magento2/issues/38533,Framework
AC-11696,"The system now supports process fork for MView indexation, preventing errors during indexer execution when operating on multiple threads. Previously, running the ChangelogBatchWalker on multiple threads would lead to the deletion of tables used by other threads, causing an error during indexer execution.",ChangelogBatchWalker does not work in multiple threads,<https://github.com/magento/magento2/pull/38248>,https://github.com/magento/magento2/issues/38246,Framework
AC-11729,"The system now ensures that header processing is only executed once and only if the header value passes validation, enhancing security and preventing potential vulnerabilities. Previously, header processing was executed even if the header value did not pass validation, leading to potential vulnerabilities and unexpected behavior due to double processing of header values.",Magento_GraphQl execute headers processing even if the header value does not pass validation,<https://github.com/magento/magento2/commit/c8f87c25>,"",GraphQL
AC-11762,Update 2FA OTP window field with correct description and default value after BiC change,"","Updated command for the way of how otp_window period will be entered from now bin/magento config:set twofactorauth/google/otp_window VALUE
to bin/magento config:set twofactorauth/google/leeway VALUE","",Security
AC-11781,"The system now correctly names the variable that contains the amount of money that can still be refunded, preventing confusion during debugging. Previously, this variable was incorrectly named as totalRefund, which could lead to misunderstandings for developers.",[Issue] Rename wrongly named variable,<https://github.com/magento/magento2/pull/36205>,https://github.com/magento/magento2/issues/38609,Framework
AC-11798,"The system now correctly displays shipping prices in printed PDFs according to the tax configuration settings, ensuring consistency between the sales order invoice view page and the printed invoice. Previously, the shipping price displayed in the printed PDF was excluding tax, regardless of the tax configuration settings.",[Issue] Shipping price showing diffrent in printed pdf,"<https://github.com/magento/magento2/pull/38595>, <https://github.com/magento/magento2/commit/1bafc571>",https://github.com/magento/magento2/issues/38608,Order
AC-11804,"The system now correctly saves and displays the category description in the WYSIWYG editor when editing a category on the store view level. Previously, the WYSIWYG editor would appear empty after saving a category description on the store view level.",Category description WYSIWYG is empty on non default storeview,<https://github.com/magento/magento2/pull/38623>,https://github.com/magento/magento2/issues/38622,Catalog
AC-11808,Investiagte and upgrade Adobe Commerce Core dependencies list,"",Need upgrade Adobe Commerce Core dependencies list ,"",Framework
AC-11810,"The system now correctly displays the price of simple products when queried through the Order API, ensuring accurate data representation. Previously, the price of simple products was incorrectly displayed as zero in the API response.",Magento2.4.6-p4 Order API Simple Item missing price,"",https://github.com/magento/magento2/issues/38603,Pricing
AC-11811,"UPS REST ""A shipment cannot have a KGS/IN or LBS/CM or OZS/CM as its unit of measurements""","",UPS rates is visible in checkout and cart.,<https://github.com/magento/magento2/commit/9b1713d8>,Shipping
AC-11819,"The system now correctly caches pages when the MAGE_RUN_CODE parameter is set, ensuring optimal performance. Previously, pages were not being cached under these conditions, leading to potential performance issues.",Built-in FPC cache is broken in 2.4.7 for some configurations,"<https://github.com/magento/magento2/pull/38646>, <https://github.com/magento/magento2/commit/0c53bbf7>",https://github.com/magento/magento2/issues/38626,Framework
AC-11829,"The system now consistently handles exceptions between developer and production modes, preventing unexpected redirection to the login page when an exception is thrown. Previously, an inconsistency in exception handling could cause a redirect to the login page in production mode instead of displaying the exception message.",[Issue] Fix exception handling inconsistency between developer and production modes,<https://github.com/magento/magento2/pull/37712>,https://github.com/magento/magento2/issues/38639,Framework
AC-11852,"The system now labels the section for tokenizable account payment methods as ""Account"" instead of ""PayPal Account"" in the Stored Payment Methods page, making it more representative of its function. Previously, this section was specifically labeled as ""PayPal Account"", which was misleading when other tokenizable account payment methods were added.",Replace 'PayPal Account' translation in token_list.phtml,<https://github.com/magento/magento2/pull/37959>,https://github.com/magento/magento2/issues/35622,Framework
AC-11855,"The system now allows the loading of the font 'https://www.paypalobjects.com/webstatic/mktg/2014design/font/PP-Sans/PayPalSansBig-Medium.woff' without violating the Content Security Policy directive, ensuring the correct display of the Paylater Popup. Previously, the font was refused to load due to a violation of the Content Security Policy directive, causing display issues with the Paylater Popup.",[Issue] Missing Font CSP Paylater Popup,<https://github.com/magento/magento2/pull/37401>,https://github.com/magento/magento2/issues/38624,Security
AC-11874,"The ProductRepository class now maintains backward compatibility by restoring the Initialization Helper class as the second parameter, ensuring that modules extending from this class function as expected. Previously, the removal of the Initialization Helper from the constructor in the ProductRepository class resulted in a loss of backward compatibility, forcing users to employ a workaround.",Backward compatibility has been lost on Magento\Catalog\Model\ProductRepository class,"",https://github.com/magento/magento2/issues/38669,Framework
AC-11876,"The system now correctly validates sales rules, preventing the application of a coupon code to a cart when the product condition does not match any product name. Previously, a sales rule could be applied and a discount given on the shipping amount even when the product condition did not match any product name.",[Issue] Sales Rules regression in 2.4.7,<https://github.com/magento/magento2/commit/0574ac23>,https://github.com/magento/magento2/issues/38671,Cart & Checkout
AC-11878,"The system now correctly handles integer values in the GetCustomSelectedOptionAttributes function when executing a GraphQL query, preventing any type-related errors. Previously, launching a GraphQL query that used GetCustomSelectedOptionAttributes with an integer argument resulted in a type error.",[Graphql] Type issue in 2.4.7,<https://github.com/magento/magento2/pull/38663>,https://github.com/magento/magento2/issues/38662,APIs
AC-11905,"The system now correctly handles empty LESS files during static content deployment, displaying an ""LESS file is empty"" error message. Previously, an incorrect type error was thrown when encountering an empty LESS file during deployment.",[Issue] Static content deploy - Type error,<https://github.com/magento/magento2/pull/38683>,https://github.com/magento/magento2/issues/38682,Framework
AC-11907,"The system now successfully creates and functions URL rewrites with accents, preventing infinite loading during the saving process. Previously, adding a URL rewrite with an accent caused an infinite loading issue.",Adding URL rewrites with an accent causes infinite loading,<https://github.com/magento/magento2/commit/44cef3a9>,https://github.com/magento/magento2/issues/38692,SEO
AC-11911,jQuery/fileuploader css cleanup after migration to uppy library,"",Removed jQuery/fileUploader library because it has been migrated to Uppy library,<https://github.com/magento/magento2/commit/7cabfb46>,Framework
AC-11916,"[QPT] UPS REST ""A shipment cannot have a KGS/IN or LBS/CM or OZS/CM as its unit of measurements""","",UPS rates is visible in checkout and cart.,"",Shipping
AC-11919,"The system now correctly aligns the Page Actions Buttons to the right side of the sticky header in the admin panel, enhancing the professional look and feel. Previously, these buttons were incorrectly floating to the left side of the sticky header.",Admin: Page Actions Buttons floating left instead of right,<https://github.com/magento/magento2/commit/44cef3a9>,https://github.com/magento/magento2/issues/38701,Account
