ACP2E-3391,[Cloud] Unable to set custom_attributes while comany creation over the graphql call,"","After the fix, it's possible to set the ""custom_attributes"" attribute for the company admin during company creation using graphql request.","","B2B, GraphQL"
ACP2E-3392,Broken validation for “Maximum Qty Allowed in Shopping Cart”,"","Previously, when we put `Maximum Qty Allowed in Shopping Cart` empty, it did not throw any exception, though an empty value is not accepted here. After this fix applies, putting an empty string will throw exceptions and will not allow saving the product.",<https://github.com/magento/magento2/commit/d50f6b5d>,Admin UI
ACP2E-3402,Checkout shipping address form get update with wrong address,"","shippingAddressFromData is now saved into the local storage per website. Previously, an address from the wrong website could be auto-populated into the shipping address form during checkout if a store code was used in the URL and checkout was initiated from multiple websites during the same guest session.",<https://github.com/magento/magento2/commit/078c387e>,Cart & Checkout
ACP2E-3403,Cart Price Rules Miscalculating Discount,"","Fixed amount discounts are now being properly calculated. Prior to the fix, fixed amount discounts were not totalled properly for bundle products.",<https://github.com/magento/magento2/commit/0b488dd1>,Promotion
ACP2E-3404,[GraphQL] Reset password email inconsistency between content and subject/link,"","The issue has been resolved by simulating the correct store where the customer's account is registered when sending the password reset request, regardless of the website store.",<https://github.com/magento/magento2/commit/5184c067>,GraphQL
ACP2E-3405,[CLOUD] Checkout does not retain the selected billing address when Address Search is enabled,"","Checkout payment page will now retain the selected billing address when address search is enabled. Previously if ""Number of Customer Addresses Limit"" is configured to 1, and customer has more than one address, the selected billing address would disappear after reloading the page.","",Cart & Checkout
ACP2E-3406,Nested categories in rule conditions not showing,"",Fixed issue when nested categories under level 3 category are not shown in marketing rules for category condition,<https://github.com/magento/magento2/commit/88660e79>,Promotion
ACP2E-3407,Gift Card Product | Cart Merge is merging Gift Cards,"",Giftcard products now merged correctly in the cart,<https://github.com/magento/magento2/commit/88660e79>,Cart & Checkout
ACP2E-3408,[Pagebuilder Preview UI Issue] The buttons in the Page Builder column aren't lining up correctly,"","The buttons in the Page Builder columns are now correctly aligned. Previously, they were misaligned within the Page Builder columns.",<https://github.com/magento/magento2-page-builder/commit/1a52ef4c>,Admin UI
ACP2E-3410,Configurable product edit form load causes timeout and memory exhaustion,"","Prior to the fix configurable product variations were constructed based on all possible attribute option combinations. In cases where attributes had a lot of options this resulted in a lengthy and resource consuming operation. Now, configurable product variations are constructed based on existing child product attributes. This results in far less calculations - thus an improved usage of resources.",<https://github.com/magento/magento2/commit/078c387e>,Catalog
ACP2E-3413,All products are indexed with [is_out_of_stock] = 1 when the SKU is not set as a searchable attribute,"","After the fix, the ""is_out_of_stock"" in catalog search index is correct, even when sku is not searchable.",<https://github.com/magento/inventory/commit/5b21b7af>,"Inventory / MSI, Search"
ACP2E-3416,Admin duplicated place order requests sent,"","Previously, the ""Submit Order"" button in the admin panel could be clicked multiple times or activated by repeatedly pressing the ""Enter"" key, causing duplicate or order submissions with error. Now, preventing additional actions until the order is fully processed, ensuring that only one order is submitted.",<https://github.com/magento/magento2/commit/5184c067>,Order
ACP2E-3419,[Cloud] products GraphQL query returns related products not assigned to current website,"","Previously, for graphQL query, multi-store related products do not show properly for product query. After this fix is applied, for products, graphQL query multi-store related products showing accordingly.",<https://github.com/magento/magento2/commit/078c387e>,GraphQL
ACP2E-3424,[Cloud] Removing template with missing images causes pub/media to be deleted,"","Previously to this fix, if the preview image name was missing for a pagebuilder template, the pub/media folder was deleted. After the fix, only the template will be deleted and the preview image if found.",<https://github.com/magento/magento2-page-builder/commit/0986853b>,"Admin UI, Staging & Preview"
ACP2E-3425,Admin can still place order even without payment method,"",Previously selected payment method is now retained when the payment method reappears in the list of available payments.,<https://github.com/magento/magento2/commit/d50f6b5d>,Order
ACP2E-3430,Latest security updates with TinyMCE 7 missing font size,"","Font size and font family selectors are now available in WYSIWYG editor. Prior to this fix, with TinyMCE 7 these were not available in the editor interface.","<https://github.com/magento/magento2/commit/d50f6b5d>, <https://github.com/magento/magento2-page-builder/commit/2c2f7a0e>",Content
ACP2E-3431,Products Ordered report is not exporting. 404 error instead.,"",Products Ordered report excport to CSV and XML now works as expected,<https://github.com/magento/magento2/commit/88660e79>,Admin UI
ACP2E-3432,usage_limit and uses_per_customer not updating in salesrule_coupon Table,"",Updating Uses per Coupon and Uses per Customer in cart price rule will now affect existing autogenerated coupons. Previously the new values affected only new coupons,<https://github.com/magento/magento2/commit/88660e79>,Promotion
ACP2E-3433,Allow Countries configuration causes issues in customer address configurations,"",Now selecting Allow Countries configuration doesn't influence countries shown for outside the given scope. Previously Allow Countries configuration influenced customer address attribute outside given scope,<https://github.com/magento/magento2/commit/078c387e>,Account
ACP2E-3441,Unable to download files from Data Collector,"",Downloading backup no longer shows blank page instead of downloading the file.,"",Other Developer Tools
ACP2E-3443,Return Screen is messed up when refresh the screen,"",The user can refresh the page without experiencing screen distortion.,"",Returns
ACP2E-3445,Shared Gift Registry shows the event date as 1 day earlier,"",Gift Registry date is shown correctly now on Storefront,"",Account
ACP2E-3447,Using the wrong Store ID in GraphQL header causes fatal memory error,"",Sending wrong store code in GraphQL request no longer results in excessive memory consumption.,<https://github.com/magento/magento2/commit/d50f6b5d>,GraphQL
ACP2E-3448,[Cloud] Wrong quantity in CSV file did not give error,"","Now stock sources import will throw validation error for non numeric values in the quantity column. Previously, importing stock sources with non numeric value in the quantity column resulted in the quantity being set to 0.",<https://github.com/magento/inventory/commit/5b21b7af>,Import / export
ACP2E-3453,Unable to Update Scheduled Update When Using Unique Custom Category Attribute,"",Fixed an issue where updating a scheduled update for a category was not possible if the category had a unique attribute,<https://github.com/magento/magento2/commit/078c387e>,Staging & Preview
ACP2E-3454,Fotorama doesn't load video correctly when using Swatches and option is pre-selected via URL,"","Product videos will now render properly on configurable product details page, if the URL contains selected options.",<https://github.com/magento/magento2/commit/078c387e>,Catalog
ACP2E-3456,"Cart price rule doesn't consider parent category when it is using ""equals or greater than"" condition.","",Cart Price Rules now consider parent category correctly when it is used in advanced conditions,<https://github.com/magento/magento2/commit/93359343>,Promotion
ACP2E-3457,TinyMCE JS Error in console after Js minification enable with production mode,"","Previously, enabling JavaScript minification in production mode within the admin panel caused JavaScript errors related to TinyMCE 7 to appear in the browser console, affecting the functionality and user experience. Now, This issue has been resolved, ensuring that TinyMCE 7 operates smoothly without generating any errors, even when JS minification is enabled.",<https://github.com/magento/magento2/commit/56463d5e>,Admin UI
ACP2E-3458,[MFTF] StorefrontCheckoutProcessForQuoteWithoutNegotiatedPricesTest,"",Fixed mftfs,<https://github.com/magento/magento2/commit/078c387e>,Test framework
ACP2E-3459,Request for additional changes to fully complete the ACP2E-3375 fix,"",'-,<https://github.com/magento/magento2/commit/d50f6b5d>,Admin UI
ACP2E-3461,PageBuilder Carousel Widget shows products that doesn't match conditions,"",Product list used in widgets now respects category condition,<https://github.com/magento/magento2/commit/078c387e>,Catalog
ACP2E-3463,Invalid discount calculation with priority,"","In the case of fixed amount appllied for the whole cart discount type, the amount was not being calculated properly for cart items that were already discounted by a previous promotion. Now, discounts are properly summed up.",<https://github.com/magento/magento2/commit/078c387e>,Promotion
ACP2E-3465,Place order button disappears in Purchase Order details,"",Fixed an issue where Place order button was hidden for approved purchase orders when a product variation had minimum number in card specified,"",B2B
ACP2E-3467,[Cloud] 500 response to empty Graphql response on 2.4.7,"","After the fix, invalid graphql requests will not be logged into the exception.log file.",<https://github.com/magento/magento2/commit/1984c61c>,GraphQL
ACP2E-3469,Validation Error Triggered for All Products in Group When One Has Invalid Quantity,"","Now, the validation error is correctly triggered for all products in the group when one product has an invalid quantity, which was not happening previously.",<https://github.com/magento/magento2/commit/56463d5e>,Catalog
ACP2E-3471,[Cloud] Products in Category - Add Products - Assign - Select All,"",Users can now select or deselect products using the toggle.,"",Product
ACP2E-3474,[CLOUD] No such entity with id = 0 with b2b module,"","Logged in user is able to add product to cart when Shared Catalog features are enabled.
Previously adding product to cart resulted in Error 'no such entity with id = 0'","",B2B
ACP2E-3475,Product export causes OOM even with 4G memory limit,"","Previous to this fix, the product export failed if product attributes had thousands of option values even with 4G available memory. After this fix, the product export should finish exporting the csv file.",<https://github.com/magento/magento2/commit/1984c61c>,Import / export
ACP2E-3476,[Cloud] Product import time has significantly increased,"","Previous to the fix, catalog product import with over 10K entries had a significant time degradation. After the fix, the import of catalog product executes in a timely manner.",<https://github.com/magento/magento2/commit/87d012e5>,"Import / export, Performance"
ACP2E-3486,Default values are not set for date and time attributes with products RestAPI,"",Default values now sets properly for date and date and time attributes via RestAPI,<https://github.com/magento/magento2/commit/1984c61c>,APIs
ACP2E-3488,"Existing quote data is not update / not visible, instead create a new quote record when trigger_recollect = 1","",Customer's shopping cart items no longer disappear as result of a product being deleted after it was added to the shopping cart.,<https://github.com/magento/magento2/commit/1984c61c>,Cart & Checkout
ACP2E-3498,Incorrect discount value when multiple cart price rules are applied simultaneously with discounted/special priced products,"","Prior to the fix, fixed amount for whole cart rules were not being applied properly if more than one was being applied. Now, fixed amount discount cart rules are being applied properly.",<https://github.com/magento/magento2/commit/1984c61c>,Promotion
ACP2E-3516,Indexers Temporary tables are not cleaned up if the process is terminated,"",CatalogRule indexer temporary tables are now cleaned up if the indexer process is terminated,<https://github.com/magento/magento2/commit/1984c61c>,Catalog
ACP2E-3520,[QUANS] Core unit test failures in 2.4.7-p3,"",Release notes for this test is not needed since it is a Unit-test improvement.,<https://github.com/magento/magento2/commit/1984c61c>,Catalog
ACP2E-3521,[CLOUD] Issue with Products are Not Visible in Frontend After Saving in Magento Admin,"",After the fix configurable products that have child products with long names will not be missed in the storefront.,<https://github.com/magento/magento2/commit/1984c61c>,"Catalog, Search"
ACP2E-948,"Product listing GraphQL query limited to total_count 10,000 products only","","After the fix, the search result is not limited to 10000 products, it becomes possible to get all products matching the search criteria even if the count is more than 10000.",<https://github.com/magento/magento2/commit/a4cf5e62>,"GraphQL, Search"
LYNX-426,The discount_percentage is not calculated for bundle products with dynamic price,"","","",Other
LYNX-485,"Bundle products still shows ""IN_STOCK"" when one of its bundled product out of stock","","","",Other
LYNX-486,not_available_message and only_x_left_in_stock doesn't show the same available stock,"","","",Other
LYNX-488,original_row_total field returning wrong value,"","","",Other
LYNX-503,Grouped product thumbnail should be shown according to the configuration     .,"","","",Other
LYNX-510,Error when querying selected_options in OrderAddress,"","","",Other
LYNX-512,original_item_price is not including discounts,"","","",Other
LYNX-530,Not available message is not showing the available inventory quantity,"","","",Other
LYNX-532,"""OUT_OF_STOCK"" status returns on Simple with custom options products with multi select options","","","",Other
LYNX-533,Error (GQL): cart.itemsV2.items.product.custom_attributesV2 returns a server error,"","","",Other
LYNX-536,orders/date_of_first_order always returning null,"","","",Other
LYNX-544,Customer must not be able to cancel a partially shipped order,"","","",Other
LYNX-548,Error codes for order cancellation based on the error message,"","","",Other
LYNX-581,Move back cookie-related properties from private to protected,"","","",Other
LYNX-600,Increase max default GraphQL query complexity to 1000,"","","",GraphQL
