AC-11937,Update 2FA OTP window field with correct description and default value after BiC change,"","Updated command for the way of how otp_window period will be entered from now bin/magento config:set twofactorauth/google/otp_window VALUE
to bin/magento config:set twofactorauth/google/leeway VALUE","",Security
AC-11938,Ensure to UPS rates should visible in checkout and cart.,"UPS REST ""A shipment cannot have a KGS/IN or LBS/CM or OZS/CM as its unit of measurements""",<https://github.com/magento/magento2/commit/493e01f5>,https://github.com/magento/magento2/issues/38618,Shipping
AC-11983,"[QPT] UPS REST ""A shipment cannot have a KGS/IN or LBS/CM or OZS/CM as its unit of measurements""","",UPS rates is visible in checkout and cart.,"",Shipping
AC-11984,"[QPT] UPS REST ""A shipment cannot have a KGS/IN or LBS/CM or OZS/CM as its unit of measurements""","",UPS rates is visible in checkout and cart.,"",Shipping
AC-11992,"The system now includes the AdminClickAddOptionForBundleItemsActionGroup, enhancing the functionality of the admin panel. Previously, this action group was not available.",[Issue] [MFTF] Added AdminClickAddOptionForBundleItemsActionGroup,<https://github.com/magento/magento2/pull/30838>,https://github.com/magento/magento2/issues/30857,Product
AC-11993,"The system now correctly handles custom shipping methods without shipping rates validation rules, ensuring that the loader does not block the shipping methods after the postcode is changed in the shipping address during checkout. Previously, changing the postcode in the shipping address during checkout would cause the loader to block the shipping methods and not disappear when custom shipping methods without shipping rates validation rules were used.","[Issue] The loader blocks the shipping methods after the postcode is changed, shipping rates validation rules",<https://github.com/magento/magento2/commit/1bafc571>,https://github.com/magento/magento2/issues/38742,Cart & Checkout
AC-11999,"The system now correctly displays constructor parameters when executing the dev:di:info command, preventing any errors from occurring. Previously, executing this command resulted in an error due to a type mismatch in the argument.",dev:di:info error in magento 2.4.7,<https://github.com/magento/magento2/commit/0c53bbf7>,https://github.com/magento/magento2/issues/38740,Account
AC-12000,"The system now includes a new critical head block and moves critical CSS before assets, allowing for more customization and performance optimization in the frontend. Previously, the critical CSS was not positioned before the assets, limiting customization and optimization opportunities.",[Issue] Code cleanup and add new critical head block and move critical css before assets,<https://github.com/magento/magento2/pull/35580>,https://github.com/magento/magento2/issues/38748,Performance
AC-12002,"The system now ensures that there are no extra spaces in the link and script tags, providing cleaner and more efficient code. Previously, double spaces could be found between attributes in the link and script tags.",[Issue] [View] Removed extra space in link and script tag,<https://github.com/magento/magento2/pull/32919>,https://github.com/magento/magento2/issues/32920,Framework
AC-12015,ExtJs folder cleanup after migration to jsTree library,"",Removed extJs folder as the related functionality has been migrated to jsTree,<https://github.com/magento/magento2/commit/7cabfb46>,Framework
AC-12022,Upgrade monolog/monolog system dependency to the latest major version ,"","The system has been updated to use the latest major version of the ""monolog/monolog:^3.x"" library, ensuring compatibility and improved performance. Previously, the system was using an outdated version of the ""monolog/monolog"" library which could have led to potential issues and limitations.",<https://github.com/magento/magento2/commit/edcd0dcc>,Framework
AC-12023,Upgrade wikimedia/less.php dependency to the latest major version ,"","The system has been updated to use the latest major version 5.x of the ""wikimedia/less.php"" library, ensuring compatibility and up-to-date functionality. Previously, the system was using an outdated version of the library which could have led to security issues.",<https://github.com/magento/magento2/commit/edcd0dcc>,Framework
AC-12024,Upgrade jquery/validate library dependency to the latest minor version,"",Upgrade jquery/validate library dependency to the latest minor version 1.20.0,<https://github.com/magento/magento2/commit/de4dfb8e>,Framework
AC-12025,Upgrade moment.js system dependency to the latest minor version,"",Upgrade moment.js system dependency to the latest minor version 2.30.1,<https://github.com/magento/magento2/commit/de4dfb8e>,Framework
AC-12060,"The system now correctly calculates taxes when only a zip code is provided, ensuring accurate tax estimations for both Luma (Rest API) and GraphQL. Previously, only shipping estimates were calculated and taxes were not included when only a zip code was provided.",Both Luma (Rest API) and Graphql  does not calculate taxes when only Zip code is provided.,"","","APIs, GraphQL, Tax"
AC-12076,"The system now correctly uses the words ""item"" and ""items"" in the layered navigation filter item, enhancing the clarity and accuracy of the filter descriptions. Previously, these words were used incorrectly, leading to potential confusion for users navigating the filter options.",[Issue] Fix wording of filter item on layered navigation,<https://github.com/magento/magento2/pull/37852>,https://github.com/magento/magento2/issues/38789,Catalog
AC-12119,"The Instant Purchase feature incorrectly selected the more expensive In-Store Delivery option for configurable products instead of the cheapest Flat Rate method. This fix ensures that the correct shipping method is chosen based on the actual price.""","Instant purchase ""cheapest shipping"" broken for configurable products","<https://github.com/magento/magento2/pull/38819>, <https://github.com/magento/magento2/commit/29fe9097>",https://github.com/magento/magento2/issues/38811,"Cart & Checkout, Shipping"
AC-12128,Prototype.js security vulnerability fix CVE-2020-27511,"","The system has been updated to address the security vulnerability CVE-2020-27511 in Prototype.js 1.7.3, enhancing the overall security of the system. Prior to this update, the system was susceptible to a Regular Expression Denial of Service (ReDOS) through stripping crafted HTML tags.",<https://github.com/magento/magento2/commit/de4dfb8e>,UI Framework
AC-12128,"The system has been updated to address the security vulnerability CVE-2020-27511 in Prototype.js 1.7.3, enhancing the overall security of the system. Prior to this update, the system was susceptible to a Regular Expression Denial of Service (ReDOS) through stripping crafted HTML tags.",Prototype.js security vulnerability fix CVE-2020-27511,<https://github.com/magento/magento2/commit/de4dfb8e>,"",UI Framework
AC-12162,Ensure all validation should work after upgrade moment.js system dependency to the latest minor version,Front end - Date of birth validation is failing in Customer creation page,<https://github.com/magento/magento2/commit/de4dfb8e>,"",Customer/ Customers
AC-12164,"The system now correctly applies the configured date format to product custom options of type Date, ensuring that the date format is displayed correctly on the front-end. Previously, changes to the date format configuration did not reflect on the front-end for product custom options of type Date.",Date and Time Format for Custom Option Not Working,<https://github.com/magento/magento2/pull/38925>,https://github.com/magento/magento2/issues/32990,Catalog
AC-12167,"The system now accepts product image uploads with capital letter file extensions, ensuring a smooth product creation process. Previously, image uploads with capital letter file extensions were refused, forcing users to change the file extension to lowercase.",[Bug] Magento 2.4.7 doesn't allow product photo's with capital letter file extension.,<https://github.com/magento/magento2/commit/c8f87c25>,https://github.com/magento/magento2/issues/38831,Admin UI
AC-12170,"The system now enables the discount code/coupon input field on the checkout page for virtual and downloadable products, allowing users to apply discount codes as expected. Previously, the discount code/coupon input was disabled, and the button title text displayed as ""Cancel coupon"", preventing users from applying discount codes.",Coupon code feature is not working properly in the checkout page on Magento 2.4.7,<https://github.com/magento/magento2/commit/1bafc571>,https://github.com/magento/magento2/issues/38826,Cart & Checkout
AC-12172,"The system now correctly imports product data with custom options of type 'file', ensuring that all provided file extensions are displayed and the price for the custom option is included. Previously, during product import, if a custom option of type 'file' was provided with more than one file extension, only the first extension was displayed and the price for the custom option was missing.",Issue at product import when provided with custom options-type: file (Created Product does not contain price for custom-option and show only the first file type extension provided),<https://github.com/magento/magento2/pull/38926>,https://github.com/magento/magento2/issues/38805,Import / export
AC-12176,"The system now correctly handles MySQL host configuration that includes port information, ensuring successful theme compilation. Previously, theme compilation would fail if the MySQL host configuration in the database connection included port information.",Theme compilation breaks when mysql host contains port information,<https://github.com/magento/magento2/pull/38842>,https://github.com/magento/magento2/issues/38799,Performance
AC-12189,"The system now generates less/css sourcemaps without the /pub prefix for paths when using grunt, eliminating the need for a workaround in the webserver configuration. Previously, the use of the /pub prefix in sourcemaps paths required a specific configuration in the webserver to function correctly.",Grunt Less uses pub/ prefix for sourcemaps,<https://github.com/magento/magento2/pull/38840>,https://github.com/magento/magento2/issues/38837,UI Framework
AC-12267,Support connection retries for Redis session and compatible with colinmollenhour/php-redis-session-abstract v2.0.0,"",Updated latest version of colinmollenhour/php-redis-session-abstract v2.0.0 compatible with adobe commerce,<https://github.com/magento/magento2/commit/672a2e61>,Framework
AC-12268,Upgrade league/flysystem Composer dependencies to latest version,"",Upgrade the 2.x league/flysystem Composer dependencies to latest version 3.x,"",Framework
AC-12283,"The system now successfully completes the static content deployment process when the Magento_CSP module is enabled and ""dev/js/translate_strategy"" is set to ""embedded"", without triggering the ""Area code not set"" error. Previously, under these conditions, the static content deployment process would fail with an ""Area code not set"" error.","""Area code not set"" after update to 2.4.5-p8",<https://github.com/magento/magento2/pull/38922>,https://github.com/magento/magento2/issues/38845,Content
AC-12309,Update user documentation for two-factor authentication (2FA) to change otp_window command,"",Update user documentation for two-factor authentication (2FA) to change OTP_WINDOW settings command as per: https://jira.corp.adobe.com/browse/AC-11762,"",Security
AC-12571,"","Navigating in the categories tree leads to errors in Redis: ""Redis session exceeded concurrent connections""",<https://github.com/magento/magento2/commit/0611e750>,https://github.com/magento/magento2/issues/38851,Other Developer Tools
AC-12594,"The system now uses the compiled configuration for generated data instead of the general configuration, reducing network transfer and overhead of data that depends on a certain version of code. This change prevents cache overriding in shared instances during container swapping, leading to improved stability and reduced downtime. Previously, certain core classes used shared config type, which could lead to cache overriding or application downtime due to differences in code versions across multiple servers.",[Issue] Use compiled config for generated data instead of general config,<https://github.com/magento/magento2/pull/29954>,https://github.com/magento/magento2/issues/38785,Framework
AC-12597,"The system now removes references to files from extjs which were previously removed, eliminating errors in the browser's console and the system log file. Previously, these references were causing errors due to the absence of the referenced files.",[Issue] Remove references to files from extjs which got removed in e1ccdb…,<https://github.com/magento/magento2/pull/38951>,https://github.com/magento/magento2/issues/38960,Framework
AC-12715,Update laminas composer dependencies upgrading to latest version,"","The system now supports the latest versions of laminas composer dependencies:
laminas/laminas-servicemanager
laminas/laminas-server
laminas/laminas-stdlib
laminas/laminas-validator
ensuring compatibility and up-to-date functionality. Previously, updating to the latest versions of these dependencies could cause backward incompatibility issues and test failures.",<https://github.com/magento/magento2/commit/b34c0a75>,Framework
AC-12750,The removal of ExtJs is logging error in browser console log and magento log,"","","",Framework
AC-12778,"The system now correctly uses the sprintf function with the appropriate number of placeholders, enhancing code cleanliness and consistency. Previously, the sprintf function was incorrectly used with an extra argument, which did not cause any major issues but was not the correct usage.","[Issue] Minor cleanup: fixed wrong usage of sprintf, it only takes 2 placeholders here and w…",<https://github.com/magento/magento2/pull/38628>,https://github.com/magento/magento2/issues/39062,Framework
AC-12823,Investigate the unit test failure due to phpunit patch update during component upgrade,"","",<https://github.com/magento/magento2/commit/b34c0a75>,Framework
AC-12866,Remove Deprecations- PhpUnit10 Integration Tests,"",Resolve the PHPUnit Deprecations,<https://github.com/magento/magento2/commit/edcd0dcc>,Framework
AC-12868,Remove Deprecations- PhpUnit10 WebApi Tests,"",Resolve the PHPUnit Deprecations,<https://github.com/magento/magento2/commit/edcd0dcc>,Framework
AC-12869,"The system now correctly references classes in modules, ensuring smoother operation and preventing crashes due to non-existing classes. This includes a bugfix in the Indexer and Creditmemo modules, and the implementation of the HttpGetActionInterface in the PrintAction class. Previously, incorrect class references led to errors and potential system crashes, and certain functionalities, such as the filename for creditmemo PDF files and reindexing of stocks, were not working as expected.",[Issue] Fixes incorrect classes being referenced in Magento modules.,<https://github.com/magento/magento2/pull/37784>,https://github.com/magento/magento2/issues/39126,Framework
AC-12882,Investigate the Integration build after component upgrade,"","",<https://github.com/magento/magento2/commit/b34c0a75>,Framework
AC-13011,"",2.4.8-beta1 EE Reports are not generating due to magento exception,"","","Framework, Product"
AC-1306,"The system now excludes CSS related to disabled modules from the final CSS output files, ensuring that unnecessary styles are not loaded. Previously, CSS related to disabled modules was included in the final CSS output files, leading to the loading of extra, unnecessary styles.",Static content is deploying for disabled modules,<https://github.com/magento/magento2/pull/32922>,https://github.com/magento/magento2/issues/24666,UI Framework
AC-5969,"The system now correctly triggers product alert emails by ensuring the store identifier is of the correct data type. Previously, product alert emails were not being sent due to a type mismatch in the store identifier.","AlertProcessor - Argument #2 ($storeId) must be of type int, string given",<https://github.com/magento/magento2/commit/0574ac23>,https://github.com/magento/magento2/issues/35602,Product
AC-6071,"The storefront customer dashboard page now loads as expected when a customer logs in. Previously, customers could log in, but this page showed a 404 error. [GitHub-35838](https://github.com/magento/magento2/issues/35838)",Customer is logged in but showing 404 error in frontend.,<https://github.com/magento/magento2/pull/36263>,https://github.com/magento/magento2/issues/35838,Account
AC-6738,"The system now includes a unique key on the 'option_id' and 'store_id' columns in the 'eav_attribute_option_value' table, preventing the possibility of an option having multiple values for the same store view. Previously, faulty code could result in an option having multiple values for the same store view, causing issues when editing products or attributes.",Missing unique key on eav_attribute_option_value table,<https://github.com/magento/magento2/pull/28796>,https://github.com/magento/magento2/issues/24718,Catalog
AC-6754,"The system now correctly uses the term ""subscribers"" in the JavaScript file, ensuring proper functionality of the related features. Previously, a typographical error in the JavaScript file resulted in the incorrect use of the term ""subsctibers"".",typo error on a js file.,<https://github.com/magento/magento2/pull/36171>,https://github.com/magento/magento2/issues/36163,Framework
AC-6975,"All new indexers are by default in **[!UICONTROL Update by Schedule]** mode.  Previously, the default mode was **[!UICONTROL Update on Save]**. Existing indexers are not affected. [GitHub-36419](https://github.com/magento/magento2/issues/36419)",[Issue] Set default indexer mode to 'schedule',<https://github.com/magento/magento2/commit/0b410856>,https://github.com/magento/magento2/issues/36419,Admin UI
AC-7050,"The system now correctly displays the category selection tree in the product edit section in the same order as set in Catalog->Categories, making product administration easier in large catalogues. Previously, the category tree in the product edit section was displayed in the order of category creation, regardless of the display order set in Catalog->Categories.",Category selection tree in edit product is not in the same order as set in Catalog->Categories,<https://github.com/magento/magento2/pull/36104>,https://github.com/magento/magento2/issues/36101,"Catalog, Product"
AC-7700,"The system now automatically removes unused changelog tables when an index is switched from 'update on schedule' to 'update on save', marking the index as invalid to ensure no entries are missed. Previously, switching an index to 'update on save' would leave unused changelog tables in the system and mark all changed indexes as 'valid'.",[Issue] Drop indexer changelog tables on mview unsubscribe,<https://github.com/magento/magento2/pull/25859>,https://github.com/magento/magento2/issues/29789,Admin UI
AC-7976,"The system now supports custom scalar types for GraphQL schema, allowing developers to define custom scalar types and implementations. This feature can be particularly useful for expressing values that may require validation, such as HTML, emails, URLs, dates, etc., and for more advanced cases like EAV attributes. Previously, the system did not support the processing of custom scalar types in GraphQL.",[Issue] Introduced support of custom scalar types for GraphQL schema,"<https://github.com/magento/magento2/pull/34651>, <https://github.com/magento/magento2/commit/0574ac23>",https://github.com/magento/magento2/issues/36877,"Framework, GraphQL"
AC-8089,Investigate the league/flysystem Composer dependencies upgrading to latest version,"","","",Framework
AC-8103,"The system now allows for the translation of the text ""VAT"", ""T"", ""F"" in the address renderers, enabling users to translate these terms to the specific language of the store. Previously, these terms were not translatable, forcing users to employ a workaround.",Translation VAT in address renderer,<https://github.com/magento/magento2/pull/36943>,https://github.com/magento/magento2/issues/36942,Cart & Checkout
AC-8297,"The system now uses the visibility class for the category product indexer instead of hardcoded values, enhancing modularity. Previously, hardcoded values were used in the category product indexer, limiting flexibility and adaptability.","[Issue] Use visibility class for category product indexer, instead of hardcoded values",<https://github.com/magento/magento2/pull/37199>,https://github.com/magento/magento2/issues/37200,Catalog
AC-8353,"The system now adheres to coding standards by removing the forbidden `@author` tag from certain modules, ensuring cleaner and more standardized code. Previously, the `@author` tag was present in some modules, which was against the established coding standards.",[Issue] Remove forbidden `@author` tag,<https://github.com/magento/magento2/pull/37003>,https://github.com/magento/magento2/issues/37253,Framework
AC-8356,"The system now adheres to the coding standard by removing the forbidden `@author` tag from certain modules, ensuring cleaner and more standardized code. Previously, the `@author` tag was present in some modules, which was against the established coding standards.",[Issue] Remove forbidden `@author` tag from `Magento_Customer` (part 2),<https://github.com/magento/magento2/pull/37000>,https://github.com/magento/magento2/issues/37250,Framework
AC-8659,"The system now correctly applies a 4-space indent to the composer and auth.json files, following a fix to a syntax error in the editorconfig. Previously, due to a space in the editorconfig syntax, these files were incorrectly formatted with a 2-space indent.","Space in editorconfig syntax breaks rule for [{composer,auth}.json]",<https://github.com/magento/magento2/pull/37395>,https://github.com/magento/magento2/issues/37394,Framework
AC-8951,"The system now correctly sorts the options of physical gift card products when queried via GraphQL, ensuring consistent rendering with the Luma theme. Previously, the sort order was incorrect according to luma theme, leading to incorrect display and ordering of options such as sender name, recipient name, and amount.",Physical Giftcard options don't have the right sorting order,<https://github.com/magento/magento2/commit/1bafc571>,"",GraphQL
AC-8984,"The system now adds more colors to the output of certain setup command line interface (CLI) commands, enhancing readability and user experience. Previously, the output of these commands was harder to read due to lack of color differentiation.",[Issue] Adds some more colors to the output of certain setup cli commands,<https://github.com/magento/magento2/pull/29298>,https://github.com/magento/magento2/issues/29335,Framework
AC-9007,"The system now ensures that backend block context is not loaded on the frontend, preventing the creation of unnecessary backend sessions and potential session locks. Previously, the system was incorrectly loading the backend block context on the frontend, leading to the creation of backend sessions and potential session locks.",[Issue] Do not load backend block context on frontend,<https://github.com/magento/magento2/pull/36368>,https://github.com/magento/magento2/issues/37617,UI Framework
AC-9157,"The system now ensures that the resolver cache is not invalidated when creating, editing, moving, or deleting a staging update, but only when the staging update is applied to the entity. Previously, the resolver cache was invalidated prematurely, even before the staging update was applied, which led to unnecessary cache invalidations.",[GraphQL] Resolver Cache is Invalidated When Creating/Editing/Moving/Deleting a Staging Update,<https://github.com/magento/magento2/commit/0c53bbf7>,"",GraphQL
AC-9375,"The system now correctly updates the currency code in the New Product widget when the currency is changed in the frontend, ensuring consistency in currency display across the site. Previously, changing the currency in the frontend did not affect the currency code displayed in the New Product widget.",Currency code not change in New product widget,<https://github.com/magento/magento2/pull/37899>,https://github.com/magento/magento2/issues/37898,Catalog
AC-9386,"Commerce now renders the **[!UICONTROL Email]** field on the checkout shipping and payment pages as expected. Previously, this field was either absent or rendered slowly.",[Random BUG] Email field isn't rendered or takes a lot of time show up in Checkout Shipping or Payment page,<https://github.com/magento/magento2/commit/e1babcfd>,"","Cart & Checkout, Checkout/ One Page Checkout"
AC-9432,"The system now supports the use of CIDR ranges in the maintenance mode allow IP list, enabling a range of IP addresses to bypass maintenance mode. Previously, the maintenance mode allow IP list only permitted individual IP addresses to bypass maintenance mode.",[Issue] Allow use of CIDR ranges in maintenance allow list,<https://github.com/magento/magento2/pull/30699>,https://github.com/magento/magento2/issues/37943,Targeting
AC-9569,"GraphQL customer resolver cache is now invalidated as expected when a customer is edited or deleted through imports. Previously, the cache was not invalidated, and customer data could be edited or deleted during import.",[GraphQL Resolver] Customer Resolver Data is Not Invalidated From Import,<https://github.com/magento/magento2/commit/0574ac23>,"","GraphQL, Performance"
